[
    {
        "id": 18044,
        "slug": "cerasus-design-notes",
        "url": "https://yoyoarchive.org/stories/cerasus-design-notes",
        "type": "story",
        "title": "Cerasus Design Notes",
        "date_modified": "2026-05-29",
        "content": "",
        "meta": {
            "yya_story_author": "Mable",
            "yya_story_source_label": "Mable's Blog",
            "yya_story_source_url": "https://mofuble.neocities.org/blog/cerasus",
            "yya_story_subject": "Mable's Cerus Design Notes"
        },
        "terms": {},
        "relations": {},
        "folio": 2411
    },
    {
        "id": 4089,
        "slug": "dale-oliver-picture-from-1998-yoyo-boom-earliest-offstring-photo",
        "url": "https://yoyoarchive.org/stories/dale-oliver-picture-from-1998-yoyo-boom-earliest-offstring-photo",
        "type": "story",
        "title": "Dale Oliver picture from 1998 YoYo Boom – Earliest Offstring Photo?",
        "date_modified": "2026-05-29",
        "content": "",
        "meta": {
            "yya_story_author": "Andre Boulay",
            "yya_story_source_label": "YoYoExpert Forums",
            "yya_story_source_url": "https://forums.yoyoexpert.com",
            "yya_story_subject": "Possible Earliest Offstring Photo"
        },
        "terms": {},
        "relations": {},
        "folio": 627
    },
    {
        "id": 5085,
        "slug": "pun1sh3rs-yonomicon-merica-edition-adventure",
        "url": "https://yoyoarchive.org/stories/pun1sh3rs-yonomicon-merica-edition-adventure",
        "type": "story",
        "title": "Pun1sh3R’s Yonomicon ‘Merica Edition Adventure",
        "date_modified": "2026-05-29",
        "content": "",
        "meta": {
            "yya_story_author": "Pun1sh3R",
            "yya_story_source_label": "YoYoExpert Forums",
            "yya_story_source_url": "https://forums.yoyoexpert.com/t/yonomicon-2nd-edition-2024-updated-re-release-special-editions/403366/31?u=rkalajian",
            "yya_story_subject": "Pun1sh3R's Yonomicon 'Merica Edition Adventure"
        },
        "terms": {},
        "relations": {},
        "folio": 628
    },
    {
        "id": 3759,
        "slug": "the-chief-a-documentary-by-gingie",
        "url": "https://yoyoarchive.org/stories/the-chief-a-documentary-by-gingie",
        "type": "story",
        "title": "The Chief, a Documentary by Gingie",
        "date_modified": "2026-05-29",
        "content": "",
        "meta": {
            "yya_story_author": "Gingie",
            "yya_story_source_label": "Youtube",
            "yya_story_source_url": "https://www.youtube.com/watch?v=0n2vbe4WeHM",
            "yya_story_subject": "The Cheif Yo-yo"
        },
        "terms": {},
        "relations": {},
        "folio": 626
    }
]
