[
    {
        "id": 9489,
        "slug": "dave-schultes-the-past-and-future-of-off-string-yo-yo-play",
        "url": "https://yoyoarchive.org/media-archive/dave-schultes-the-past-and-future-of-off-string-yo-yo-play",
        "type": "yya_media",
        "title": "Dave Schulte’s “The Past and Future of Off-String Yo-Yo Play”",
        "date_modified": "2026-05-13",
        "content": "",
        "meta": {},
        "terms": {
            "yya_category": [
                "print"
            ]
        },
        "relations": {},
        "folio": 634
    },
    {
        "id": 9478,
        "slug": "donald-w-watsons-monograph-series-about-yo-yo-physics",
        "url": "https://yoyoarchive.org/media-archive/donald-w-watsons-monograph-series-about-yo-yo-physics",
        "type": "yya_media",
        "title": "Donald W. Watson’s Monograph Series about Yo-yo Physics",
        "date_modified": "2026-05-13",
        "content": "The Monography Series of papers written by Donald W. Watson from 2000 - 2003 are all about yo-yo physics. Initially published by Pencil Point Press, they're an amazing read that covers a wide range of topics.All five papers are available to download and read below:",
        "meta": {},
        "terms": {
            "yya_category": [
                "history",
                "print"
            ]
        },
        "relations": {},
        "folio": 631
    },
    {
        "id": 9487,
        "slug": "the-american-yo-yo-association-newsletters",
        "url": "https://yoyoarchive.org/media-archive/the-american-yo-yo-association-newsletters",
        "type": "yya_media",
        "title": "The American YO-YO Association Newsletters",
        "date_modified": "2026-08-26",
        "content": "The American Yo-Yo Association (AYYA) was an organization promoting yo-yo in the US. A membership organization, it sanctioned contests, sponsored web sites, had a Yo-Yo Hall of Fame, and published a printable online newsletter. You can find many of these newsletters below.",
        "meta": {},
        "terms": {
            "yya_category": [
                "print"
            ]
        },
        "relations": {},
        "folio": 633
    },
    {
        "id": 9485,
        "slug": "the-noble-disk-newsletters",
        "url": "https://yoyoarchive.org/media-archive/the-noble-disk-newsletters",
        "type": "yya_media",
        "title": "The Noble Disk Newsletters",
        "date_modified": "2026-05-13",
        "content": "For those that don’t know, back in a time called the nineties internet wasn’t as accessible as it is today. Believe it or not, not everyone had the internet in their home, or even had a computer! So things called “newsletters” were produced. This is how we got a lot of our yoyo information then. The Noble Disk, and the YoYoTimes, were the two main newsletters. The Noble Disk, written by Bill Alton, mainly focused on the scene in New England, and the east coast. But there is a ton of useful information in these, and history. Interestingly there is an article on “flow” in Volume 9 Issue 1.Sadly, Bill passed away on August 13, 2012. He left the original files, and the books he wrote, to his good friend \"Mr. Bay.\" I contacted Mr. Bay about getting the files to create this PDF, so that as many as possible could read it. Mr. Bay kindly sent me all of Bill's hard drives so that these could be converted and saved for future reading.You can download, a copy of the Noble Disk below.",
        "meta": {},
        "terms": {
            "yya_category": [
                "print"
            ]
        },
        "relations": {},
        "folio": 632
    },
    {
        "id": 9475,
        "slug": "the-yo-yo-a-toy-flywheel-wolfgang-burger-1984",
        "url": "https://yoyoarchive.org/media-archive/the-yo-yo-a-toy-flywheel-wolfgang-burger-1984",
        "type": "yya_media",
        "title": "The Yo-Yo, A Toy Flywheel – Wolfgang Burger 1984",
        "date_modified": "2026-05-13",
        "content": "",
        "meta": {},
        "terms": {
            "yya_category": [
                "history"
            ]
        },
        "relations": {},
        "folio": 630
    },
    {
        "id": 9491,
        "slug": "various-newspaper-articles",
        "url": "https://yoyoarchive.org/media-archive/various-newspaper-articles",
        "type": "yya_media",
        "title": "Various Newspaper Articles",
        "date_modified": "2026-05-13",
        "content": "Browse archived newspaper articles, and advertisements, on the yo-yo. The earliest article we have found was from 1888. New Volumes will be added as they are completed. Feel free to download a copy.",
        "meta": {},
        "terms": {
            "yya_category": [
                "print"
            ]
        },
        "relations": {},
        "folio": 635
    },
    {
        "id": 10051,
        "slug": "various-yo-yo-patent-docs",
        "url": "https://yoyoarchive.org/media-archive/various-yo-yo-patent-docs",
        "type": "yya_media",
        "title": "Various Yo-Yo Patent Docs",
        "date_modified": "2026-05-18",
        "content": "Various yo-yo patents, including the \"big one\", Haven & Hettrick's 1866 patent.",
        "meta": {},
        "terms": {
            "yya_category": [
                "history"
            ]
        },
        "relations": {},
        "folio": 785
    },
    {
        "id": 9443,
        "slug": "yoyo-archive-zines",
        "url": "https://yoyoarchive.org/media-archive/yoyo-archive-zines",
        "type": "yya_media",
        "title": "Yoyo Archive Zines",
        "date_modified": "2026-10-07",
        "content": "Starting in late April of 2025, the Yoyo Archive began to put out its printable zines.",
        "meta": {},
        "terms": {
            "yya_category": [
                "print"
            ]
        },
        "relations": {},
        "folio": 629
    },
    {
        "id": 21157,
        "slug": "yoyoexpert-trading-card-checklists",
        "url": "https://yoyoarchive.org/media-archive/yoyoexpert-trading-card-checklists",
        "type": "yya_media",
        "title": "YoYoExpert Trading Card Checklists",
        "date_modified": "2026-07-04",
        "content": "Collected checklists of each year's YYE Trading Cards",
        "meta": {},
        "terms": {
            "yya_category": [
                "print"
            ]
        },
        "relations": {},
        "folio": 3165
    }
]
